"ID","Category","Surface","Action promised","Timeframe (current)","Original language","Current / revised language","Status","Citation","Notes","Live URL"
"C05","Commercial response","Customer-visible (Sanity FAQ)","Sanity faq-c5 answer","Within 2-4 hours","We typically respond to commercial emergencies within 2-4 hours during business hours.","We typically respond to commercial emergencies within 2-4 hours during business hours.","Unchanged","Sanity doc: faq-c5","Commercial emergency response window","https://dfwhvac.com/faq"
"D01","Appointment scheduling","Customer-visible (Sanity FAQ)","Sanity faq-rsc1 answer","Within 1-3 business days","For routine maintenance and non-emergency repairs, we typically schedule appointments within 1-3 business days. During peak season, wait times may be slightly longer. Emergency calls are prioritized and usually addressed same-day or next-day.","For routine maintenance and non-emergency repairs, we typically schedule appointments within 1-3 business days. During peak season, wait times may be slightly longer. Emergency calls are prioritized and usually addressed same-day or next-day.","Unchanged","Sanity doc: faq-rsc1","Sets booking expectation for non-urgent appointments","https://dfwhvac.com/faq"
"E01","Quote turnaround","Customer-visible (page)","/services/system-replacement step 2","Same day","Emailed the same day. Multiple options side-by-side (good / better / best). Take as long as you need to decide.","Emailed the same day. Multiple options side-by-side (good / better / best). Take as long as you need to decide.","Unchanged","app/services/system-replacement/page.jsx:253","Replacement-quote turnaround promise","https://dfwhvac.com/services/system-replacement"
"E02","Install duration","Customer-visible (page FAQ)","/services/system-replacement FAQ","One day (typically 6–8 hours)","Most single-system residential replacements (one condenser + one furnace or air handler) are completed in one day — typically 6–8 hours on site. Larger homes with dual systems, attic access challenges, or significant duct repairs can extend into a second day.","Most single-system residential replacements (one condenser + one furnace or air handler) are completed in one day — typically 6–8 hours on site. Larger homes with dual systems, attic access challenges, or significant duct repairs can extend into a second day.","Unchanged","app/services/system-replacement/page.jsx:323","Sets install-duration expectation","https://dfwhvac.com/services/system-replacement"
"E03","Quote turnaround","Customer-visible (page)","/services/system-replacement how-it-works","Same day","sends you a written quote the same day","sends you a written quote the same day","Unchanged","app/services/system-replacement/page.jsx:354","Replacement-quote turnaround","https://dfwhvac.com/services/system-replacement"
"F01","Tool duration","JSON-LD schema","HowTo schema for /replacement-estimator","1 minute (PT1M)","totalTime: PT1M","totalTime: PT1M","Unchanged","components/SchemaMarkup.jsx (HowTo schema)","Visible to Google AI Overviews + featured snippets — view page source","https://dfwhvac.com/replacement-estimator"
"G01","Pre-qualification speed","Customer-visible (hero)","/financing hero subhead","Seconds","Pre-qualify in seconds","Pre-qualify in seconds","Unchanged","app/financing/page.jsx (hero copy)","Marketing — third-party flow","https://dfwhvac.com/financing"
"G02","Pre-qualification speed","Customer-visible (step card)","/financing how-it-works step 2","Under 60 seconds","Soft credit check, under 60 seconds, no impact on your credit score.","Soft credit check, under 60 seconds, no impact on your credit score.","Unchanged","app/financing/page.jsx (HowItWorks)","Marketing","https://dfwhvac.com/financing"
"G03","Pre-qualification speed","Customer-visible (FAQ)","/financing FAQ 'How fast is approval?'","Within 60 seconds","Most homeowners see their options within 60 seconds of submitting the pre-qualification form.","Most homeowners see their options within 60 seconds of submitting the pre-qualification form.","Unchanged","app/financing/page.jsx (FAQ)","Marketing","https://dfwhvac.com/financing"
"H01","Business hours","Customer-visible (footer)","Sitewide footer hours","Mon-Fri 7AM-6PM","Mon-Fri: 7AM-6PM, Sat-Sun: Closed","Mon-Fri: 7AM-6PM, Sat-Sun: Closed","Unchanged (canonical)","components/Footer.jsx:98","Source of truth for operating hours — visible on every page","https://dfwhvac.com/"
"H02","Business hours","JSON-LD schema","openingHoursSpecification","Mo-Fr 07:00-18:00","Monday-Friday 07:00-18:00","Monday-Friday 07:00-18:00","Unchanged (canonical)","components/SchemaMarkup.jsx (openingHoursSpecification)","JSON-LD — view homepage source","https://dfwhvac.com/"
"H03","Business hours","Customer-visible (Sanity FAQ)","Sanity faq-rs3 answer","Office: 7 AM | Service appts: 9 AM - 6 PM","during our business hours (Monday-Friday, 9 AM - 6 PM)","Service appointments are scheduled Monday-Friday between 9 AM and 6 PM (our office is open from 7 AM if you need to call ahead).","Updated this session (9 AM service distinction)","Sanity doc: faq-rs3","Distinguishes office hours (7 AM) from service-appt earliest (9 AM)","https://dfwhvac.com/faq"
"H04","Business hours","Customer-visible (Sanity FAQ)","Sanity faq-c3 answer","Service appts 9 AM - 6 PM","operating hours (Monday-Friday, 9 AM - 6 PM)","Our service appointments are scheduled Monday-Friday between 9 AM and 6 PM, with flexibility built in to minimize impact on your operations.","Updated this session (9 AM service distinction)","Sanity doc: faq-c3","Commercial FAQ — service-appt language","https://dfwhvac.com/faq"
"H05","Business hours","Customer-visible (Sanity FAQ)","Sanity faq-rsc3 answer","Office: 7 AM - 6 PM | Service appts: 9 AM - 6 PM","Monday through Friday, 9:00 AM to 6:00 PM. We are closed on Saturday and Sunday.","Our office is open Monday through Friday, 7:00 AM to 6:00 PM, and service appointments are scheduled between 9:00 AM and 6:00 PM. We are closed on Saturday and Sunday.","Updated this session (9 AM service distinction)","Sanity doc: faq-rsc3","Distinguishes office hours from service-appt earliest","https://dfwhvac.com/faq"
"H06","Business hours","Customer-visible (Sanity FAQ)","Sanity '2b207bd8...' answer ('What time do you open?')","Office: 7 AM | Service appts: 9 AM - 6 PM | Same-day when available","We schedule service calls between the hours of 9 - 6 pm.","Our office is open Monday through Friday from 7 AM. Service appointments are scheduled between 9 AM and 6 PM. Emergency calls placed during office hours are dispatched same-day when available; voicemails left after hours are returned the next business morning.","Updated this session (9 AM service distinction + when-available)","Sanity doc id: 2b207bd8-9bd7-40e3-82fa-6264e4704b10","Now distinguishes office vs. service-appt hours and hedges emergency dispatch","https://dfwhvac.com/faq"
"I01","Company history","Customer-visible (Sanity FAQ)","Sanity faq-rs5 answer ('How long has DFW HVAC been in business?')","Founded 2020; 50+yr family legacy back to 1972","DFW HVAC has been family-owned and operated since 1974 - that's over 50 years of serving the Dallas-Fort Worth community. Our longevity speaks to our commitment to quality service, fair pricing, and customer satisfaction.","DFW HVAC was founded in 2020 — the third generation of my family's 50-plus-year HVAC legacy in Texas. The legacy began in 1972 with my grandfather Garland Nevil, continued through my father Ronny Grubb, and now lives on at DFW HVAC. We hold to the customer-first standards I grew up with — every call, every diagnosis, every install. Read the whole three-generation history on our About page at /about","Updated this session (Option B copy)","Sanity doc: faq-rs5","Brand-truth fix — replaced fictional 1974 founding date with canonical 2020 founding + 1972 family legacy. Includes /about link via FAQAccordion LINK_RULE","https://dfwhvac.com/faq"
